{
  "schema_version": 1,
  "scope": [
    "ACTUAL_LEDGER",
    "ADCB_CLOSED_HISTORY",
    "FAB_NON_CREDIT",
    "SARWA_WEALTH",
    "CARD_STATEMENT_SOURCES",
    "MORTGAGE_PROFILES"
  ],
  "bootstrap_static_sha256": "82d6a4d1980aa65165cfbc5c97fc0d220ec3d98746259c1aa355e8b76b06f8db",
  "providers": [
    {
      "provider_id": "adcb",
      "inventory_status": "COMPLETE",
      "discovery_required": false,
      "blocker": null,
      "evidence": "config/evidence/adcb-closed-card-status-2026-08-19.json"
    },
    {
      "provider_id": "fab",
      "inventory_status": "COMPLETE",
      "discovery_required": false,
      "blocker": null,
      "evidence": "config/evidence/browser-captures/fab-non-credit-inventory-2026-08-19.json"
    },
    {
      "provider_id": "sarwa",
      "inventory_status": "COMPLETE",
      "discovery_required": false,
      "blocker": null,
      "evidence": "tests/fixtures/sarwa-holdings.sample.json"
    },
    {
      "provider_id": "adib",
      "inventory_status": "INCOMPLETE",
      "discovery_required": true,
      "blocker": "ADIB_MORTGAGE_ACCOUNT_DISCOVERY_REQUIRED",
      "evidence": null
    },
    {
      "provider_id": "ei",
      "inventory_status": "INCOMPLETE",
      "discovery_required": true,
      "blocker": "EI_CREDIT_ACCOUNT_INVENTORY_REQUIRED",
      "evidence": null
    },
    {
      "provider_id": "fab-credit",
      "inventory_status": "INCOMPLETE",
      "discovery_required": true,
      "blocker": "FAB_CREDIT_ACCOUNT_INVENTORY_REQUIRED",
      "evidence": null
    },
    {
      "provider_id": "rak",
      "inventory_status": "INCOMPLETE",
      "discovery_required": true,
      "blocker": "RAKBANK_CREDIT_ACCOUNT_INVENTORY_REQUIRED",
      "evidence": null
    },
    {
      "provider_id": "sc",
      "inventory_status": "INCOMPLETE",
      "discovery_required": true,
      "blocker": "STANDARD_CHARTERED_CREDIT_ACCOUNT_INVENTORY_REQUIRED",
      "evidence": null
    },
    {
      "provider_id": "wio",
      "inventory_status": "INCOMPLETE",
      "discovery_required": true,
      "blocker": "WIO_CREDIT_ACCOUNT_INVENTORY_REQUIRED",
      "evidence": null
    }
  ],
  "accounts": [
    {
      "provider_id": "adcb",
      "account_key": "actual:adcb:credit:8833-6838",
      "provider_account_id": "adcb:credit:8833-6838",
      "provider_identity_status": "EVIDENCED",
      "provider_identity_source": "config/evidence/adcb-closed-card-status-2026-08-19.json",
      "display_name": "ADCB Credit Card · 8833 / 6838",
      "actual_account_name": "ADCB Credit Card · 8833 / 6838",
      "account_type": "credit",
      "currency": "AED",
      "last4": "8833",
      "owner": null,
      "lifecycle_status": "CLOSED",
      "active": false,
      "retain_history": true,
      "include_in_active_routing": false,
      "include_in_actual": true,
      "actual_offbudget": false,
      "include_in_net_worth": false,
      "balance_sign": "LIABILITY_NEGATIVE",
      "balance_evidence_status": "EVIDENCED",
      "expected_balance_minor": 0,
      "balance_reconciliation_required": true,
      "balance_source": "config/evidence/adcb-closed-card-status-2026-08-19.json#issuer_statement",
      "balance_as_of": null,
      "actual": {
        "bootstrap": false,
        "name": "ADCB Credit Card · 8833 / 6838",
        "type": "credit",
        "offbudget": false,
        "aliases": ["ADCB Credit Card · 8833"],
        "card_code": "ADCB_CASHBACK",
        "card_last4": ["8833", "6838"]
      }
    },
    {
      "provider_id": "ei",
      "account_key": "actual:ei:credit:0082",
      "provider_account_id": null,
      "provider_identity_status": "UNAVAILABLE",
      "provider_identity_source": null,
      "display_name": "Emirates Islamic Amazon Credit Card · 0082",
      "actual_account_name": "Emirates Islamic Amazon Credit Card · 0082",
      "account_type": "credit",
      "currency": "AED",
      "last4": "0082",
      "owner": null,
      "lifecycle_status": "ACTIVE",
      "active": true,
      "retain_history": true,
      "include_in_active_routing": false,
      "include_in_actual": true,
      "actual_offbudget": false,
      "include_in_net_worth": true,
      "balance_sign": "LIABILITY_NEGATIVE",
      "balance_evidence_status": "UNAVAILABLE",
      "expected_balance_minor": null,
      "balance_reconciliation_required": false,
      "balance_source": null,
      "balance_as_of": null,
      "actual": {
        "bootstrap": true,
        "name": "Emirates Islamic Amazon Credit Card · 0082",
        "type": "credit",
        "offbudget": false,
        "card_code": "EI_AMAZON",
        "card_last4": ["0082"]
      }
    },
    {
      "provider_id": "fab-credit",
      "account_key": "actual:fab-credit:credit:6031",
      "provider_account_id": null,
      "provider_identity_status": "UNAVAILABLE",
      "provider_identity_source": null,
      "display_name": "FAB Credit Card · 6031",
      "actual_account_name": "FAB Credit Card · 6031",
      "account_type": "credit",
      "currency": "AED",
      "last4": "6031",
      "owner": null,
      "lifecycle_status": "ACTIVE",
      "active": true,
      "retain_history": true,
      "include_in_active_routing": false,
      "include_in_actual": true,
      "actual_offbudget": false,
      "include_in_net_worth": true,
      "balance_sign": "LIABILITY_NEGATIVE",
      "balance_evidence_status": "UNAVAILABLE",
      "expected_balance_minor": null,
      "balance_reconciliation_required": false,
      "balance_source": null,
      "balance_as_of": null,
      "actual": {
        "bootstrap": true,
        "name": "FAB Credit Card · 6031",
        "type": "credit",
        "offbudget": false,
        "card_code": "FAB_6031",
        "card_last4": ["6031"]
      }
    },
    {
      "provider_id": "fab",
      "account_key": "actual:fab:current:2001",
      "provider_account_id": "fab:current:2001",
      "provider_identity_status": "EVIDENCED",
      "provider_identity_source": "config/evidence/browser-captures/fab-non-credit-inventory-2026-08-19.json",
      "display_name": "FAB Elite Gold Current Account · 2001",
      "actual_account_name": "FAB Elite Gold Current Account · 2001",
      "account_type": "checking",
      "currency": "AED",
      "last4": "2001",
      "owner": null,
      "lifecycle_status": "ACTIVE",
      "active": true,
      "retain_history": true,
      "include_in_active_routing": false,
      "include_in_actual": true,
      "actual_offbudget": false,
      "include_in_net_worth": true,
      "balance_sign": "ASSET_POSITIVE",
      "balance_evidence_status": "EVIDENCED",
      "expected_balance_minor": 22501145,
      "balance_reconciliation_required": true,
      "balance_source": "config/evidence/browser-captures/fab-non-credit-inventory-2026-08-19.json#fab:current:2001",
      "balance_as_of": "2026-08-19",
      "actual": {
        "bootstrap": true,
        "name": "FAB Elite Gold Current Account · 2001",
        "type": "checking",
        "offbudget": false,
        "card_code": "FAB_CURRENT_2001",
        "card_last4": ["2001"]
      }
    },
    {
      "provider_id": "fab",
      "account_key": "actual:fab:current:2008",
      "provider_account_id": "fab:current:2008",
      "provider_identity_status": "EVIDENCED",
      "provider_identity_source": "config/evidence/browser-captures/fab-non-credit-inventory-2026-08-19.json",
      "display_name": "FAB Elite Gold Current Account · 2008",
      "actual_account_name": "FAB Elite Gold Current Account · 2008",
      "account_type": "checking",
      "currency": "EUR",
      "last4": "2008",
      "owner": null,
      "lifecycle_status": "ACTIVE",
      "active": true,
      "retain_history": true,
      "include_in_active_routing": false,
      "include_in_actual": true,
      "actual_offbudget": false,
      "include_in_net_worth": true,
      "balance_sign": "ASSET_POSITIVE",
      "balance_evidence_status": "EVIDENCED",
      "expected_balance_minor": 0,
      "balance_reconciliation_required": true,
      "balance_source": "config/evidence/browser-captures/fab-non-credit-inventory-2026-08-19.json#fab:current:2008",
      "balance_as_of": "2026-08-19",
      "actual": {
        "bootstrap": true,
        "name": "FAB Elite Gold Current Account · 2008",
        "type": "checking",
        "offbudget": false
      }
    },
    {
      "provider_id": "fab",
      "account_key": "actual:fab:loan:mortgage-0203",
      "provider_account_id": "fab:loan:mortgage-0203",
      "provider_identity_status": "EVIDENCED",
      "provider_identity_source": "config/evidence/browser-captures/fab-non-credit-inventory-2026-08-19.json",
      "display_name": "FAB Mortgage · 0203",
      "actual_account_name": "FAB Mortgage · 0203",
      "account_type": "mortgage",
      "currency": "AED",
      "last4": "0203",
      "owner": null,
      "lifecycle_status": "ACTIVE",
      "active": true,
      "retain_history": true,
      "include_in_active_routing": false,
      "include_in_actual": true,
      "actual_offbudget": true,
      "include_in_net_worth": true,
      "balance_sign": "LIABILITY_NEGATIVE",
      "balance_evidence_status": "EVIDENCED",
      "expected_balance_minor": -260595200,
      "balance_reconciliation_required": true,
      "balance_source": "config/evidence/browser-captures/fab-non-credit-inventory-2026-08-19.json#fab:loan:mortgage-0203",
      "balance_as_of": "2026-08-19",
      "actual": {
        "bootstrap": true,
        "name": "FAB Mortgage · 0203",
        "type": "mortgage",
        "offbudget": true
      }
    },
    {
      "provider_id": "fab",
      "account_key": "actual:fab:savings:isave-2002",
      "provider_account_id": "fab:savings:isave-2002",
      "provider_identity_status": "EVIDENCED",
      "provider_identity_source": "config/evidence/browser-captures/fab-non-credit-inventory-2026-08-19.json",
      "display_name": "FAB iSave · 2002",
      "actual_account_name": "FAB iSave · 2002",